Country,Rating,Date,Version,Username,Title,Content,Combined,Sentiment
US,1,2025-02-03,1.1.0,Infamous J7,trash,ABSOLUTELY NO SKILL BAED MATCHMAKING. you can out there and play a person with an army of magikarps and then the next round it’s nothing but mewtwo ex’s and mews. trash,trashABSOLUTELY NO SKILL BAED MATCHMAKING. you can out there and play a person with an army of magikarps and then the next round it’s nothing but mewtwo ex’s and mews. trash,Negative
US,1,2025-02-03,1.1.0,Badd3vil,Trading is a joke,"It&#39;s quite costly and not very intuitive to use. In essence, the term &#34;trading&#34; in the title feels rather misleading! Ps. And fix the Misty card. She is broken and not working. Please check the comments and Reddit !!","Trading is a jokeIt&#39;s quite costly and not very intuitive to use. In essence, the term &#34;trading&#34; in the title feels rather misleading! Ps. And fix the Misty card. She is broken and not working. Please check the comments and Reddit !!",Negative
US,4,2025-02-03,1.1.0,21Bdawg,Great game but….,"Very fun game just wish they would allow more trades than just one at a time. I would love to be able to send multiple trades at a time please! Other than that, it is a five star game like no other!","Great game but….Very fun game just wish they would allow more trades than just one at a time. I would love to be able to send multiple trades at a time please! Other than that, it is a five star game like no other!",Positive
US,1,2025-02-03,1.1.0,Motutama,Rigged Coin Flips,The coin flips at Expert mode are clearly rigged and they don’t even try to hide it. The amount of 100% heads opponents flip to my 0% heads every round takes any balance out of the game. The amount of EX Pokémon allowed per team is also game breaking. Tired of going up against opponents carrying 4+ EX Pokémon per team.,Rigged Coin FlipsThe coin flips at Expert mode are clearly rigged and they don’t even try to hide it. The amount of 100% heads opponents flip to my 0% heads every round takes any balance out of the game. The amount of EX Pokémon allowed per team is also game breaking. Tired of going up against opponents carrying 4+ EX Pokémon per team.,Negative
US,1,2025-02-03,1.1.0,BigOunceProNigua,One of the worst card games I’ve ever played,"Ridiculously simple gameplay with no room for strategy, save for purchasing overpriced digital booster packs with artificially inflated rates for those who pay more. It’s cheaper to buy the actual card and display it in your room because I know the people who farm rare cards never go outside and put 80% of their income into winning a pay to win mobile phone game. Avoid.","One of the worst card games I’ve ever playedRidiculously simple gameplay with no room for strategy, save for purchasing overpriced digital booster packs with artificially inflated rates for those who pay more. It’s cheaper to buy the actual card and display it in your room because I know the people who farm rare cards never go outside and put 80% of their income into winning a pay to win mobile phone game. Avoid.",Negative
US,3,2025-02-03,1.1.0,Koratonunz,I was excited for trading until I realized tokens are needed…,"Good game.  I really like it. My 
Kids and I bond over it. Always excited to open the new packs of the day. We were really excited for the trading to be implemented this month.  We did our first trade And then realized that we couldn’t trade anymore because of the token feature. I want to trade an extra Card that I have to my daughter, but I can’t because I have to trade it in to get tokens to trade. In my opinion, trading should be free and not have any cost within the app. This app already has too many different Tokens, tickets and hour glasses to keep track of. Stop adding new ones and just let us trade what we want please. I would give this game a 5 star rating if it were not for the trading deal with tokens.","I was excited for trading until I realized tokens are needed…Good game.  I really like it. My 
Kids and I bond over it. Always excited to open the new packs of the day. We were really excited for the trading to be implemented this month.  We did our first trade And then realized that we couldn’t trade anymore because of the token feature. I want to trade an extra Card that I have to my daughter, but I can’t because I have to trade it in to get tokens to trade. In my opinion, trading should be free and not have any cost within the app. This app already has too many different Tokens, tickets and hour glasses to keep track of. Stop adding new ones and just let us trade what we want please. I would give this game a 5 star rating if it were not for the trading deal with tokens.",Positive
US,1,2025-02-03,1.1.0,mikey Towerz,"Bad trading, Pay to win","Trading system is horrible, PAY TO WIN.","Bad trading, Pay to winTrading system is horrible, PAY TO WIN.",Negative
US,3,2025-02-03,1.1.0,OMG,Trading is useless,The trade system was completely botched. I can’t trade rare cards or cards from the new set? why even add it to the game?,Trading is uselessThe trade system was completely botched. I can’t trade rare cards or cards from the new set? why even add it to the game?,Negative
US,3,2025-02-03,1.1.0,MiniTimTim,Too many unnecessary user inputs/animations,"I love this game, it help subsidize my booster pack opening addiction but why do I need to skip past 3 animations after I’ve opened my booster. Want to complete your daily quest? Tap the quest button, tap complete all, watch the bar fill, tap claim. Why not go to quest and simply tap complete then have the rewards go straight to inventory instead of having to watch an unnecessary animation and use an unnecessary user input. There’s more situations that I can’t think of off the top of my head that are simply not needed but you get the point. This game needs a little QOL updates.","Too many unnecessary user inputs/animationsI love this game, it help subsidize my booster pack opening addiction but why do I need to skip past 3 animations after I’ve opened my booster. Want to complete your daily quest? Tap the quest button, tap complete all, watch the bar fill, tap claim. Why not go to quest and simply tap complete then have the rewards go straight to inventory instead of having to watch an unnecessary animation and use an unnecessary user input. There’s more situations that I can’t think of off the top of my head that are simply not needed but you get the point. This game needs a little QOL updates.",Negative
US,1,2025-02-03,1.1.0,AirBear-11,Trading is weird and…,The AI is an idiot,Trading is weird and…The AI is an idiot,Negative
US,1,2025-02-03,1.1.0,Mochi Puffs,Rigged Coin Flips,Do some research online of others experiencing the same HIGHLY rigged coin flip mechanics based on if your account is paid/membership or is free to play.,Rigged Coin FlipsDo some research online of others experiencing the same HIGHLY rigged coin flip mechanics based on if your account is paid/membership or is free to play.,Negative
US,1,2025-02-03,1.1.0,Bob1366wtew,Gamblers worst nightmare,"Decided to try gambling for some cards and spent some money to get nothing. That’s what this game is, abysmal pull rate game to get people to waste money on a subpar product. There’s absolutely no point to purchase gold to open packs as the rates are so low you will not get any decent cards over 4 diamonds. Not only is the rate at which you get good cards horrible, the monthly events are not anything to be content about. It’s the same two repeated events each month with no reward other than some garbage emblem. You complete the event missions to get 1 pack hourglass. Further demonstrating the Pokémon company doesn’t want you to open packs unless it’s with gold.","Gamblers worst nightmareDecided to try gambling for some cards and spent some money to get nothing. That’s what this game is, abysmal pull rate game to get people to waste money on a subpar product. There’s absolutely no point to purchase gold to open packs as the rates are so low you will not get any decent cards over 4 diamonds. Not only is the rate at which you get good cards horrible, the monthly events are not anything to be content about. It’s the same two repeated events each month with no reward other than some garbage emblem. You complete the event missions to get 1 pack hourglass. Further demonstrating the Pokémon company doesn’t want you to open packs unless it’s with gold.",Negative
US,1,2025-02-03,1.1.0,KarmaGrace,Boooooo,"The trading system is so awful, I’m not trashing all of my duplicate cool rare cards so I can get one 3 diamond card to complete the Pokédex. Also the amount of times I’ve spent money to open 10 packs only to get 10 packs with 0 holos, 0 full arts, 0 rares is astounding. This game is such a cash grab and the over powered meta decks every player uses make the game unplayable. Stick to physical cards.","BooooooThe trading system is so awful, I’m not trashing all of my duplicate cool rare cards so I can get one 3 diamond card to complete the Pokédex. Also the amount of times I’ve spent money to open 10 packs only to get 10 packs with 0 holos, 0 full arts, 0 rares is astounding. This game is such a cash grab and the over powered meta decks every player uses make the game unplayable. Stick to physical cards.",Negative
US,1,2025-02-03,1.1.0,FupusMaximus,Not everything needs monetized,Fix trading,Not everything needs monetizedFix trading,Neutral
US,3,2025-02-03,1.1.0,LinkStatik,Love hate,I enjoy pokemon and everything about pokemon but Jesus Christ I’ve been using the app for about a week now and I’m still not free to use it… tutorial tutorial tutorial guide guide guide… don’t tap anything else unless the guide tells you to… has anyone considered making an app that doesn’t force you to “play” it in a completely hand-holding linear style?? Like let people turn the tutorial off and just explore the app…,Love hateI enjoy pokemon and everything about pokemon but Jesus Christ I’ve been using the app for about a week now and I’m still not free to use it… tutorial tutorial tutorial guide guide guide… don’t tap anything else unless the guide tells you to… has anyone considered making an app that doesn’t force you to “play” it in a completely hand-holding linear style?? Like let people turn the tutorial off and just explore the app…,Negative
US,5,2025-02-03,1.1.0,💋💄🫦👄,Packs,I really like everything about this game please can you make it a tiny bit more like Pokémon go?,PacksI really like everything about this game please can you make it a tiny bit more like Pokémon go?,Positive
US,4,2025-02-03,1.1.0,Peace The Beast,"Good game, minor issues","I’ve been pretty addicted to it since it’s first few hours on the App Store almost and a lot of the game is very well refined and feels smooth and usually well rewarding for doing missions and tasks, one issue I have encountered is that the auto battle bot is not smart at all..I have seen it do some of the stupidest moves I couldn’t even imagine when it had a free win even while using a counter deck, apart from that the only other thing I wish is we could just view the cards in a pack if we don’t own them, nothing is stopping me from a 5 second google search to see what it looks like just save me the time please. Apart from those 2 little complaints the games great and I would suggest to friends. :)","Good game, minor issuesI’ve been pretty addicted to it since it’s first few hours on the App Store almost and a lot of the game is very well refined and feels smooth and usually well rewarding for doing missions and tasks, one issue I have encountered is that the auto battle bot is not smart at all..I have seen it do some of the stupidest moves I couldn’t even imagine when it had a free win even while using a counter deck, apart from that the only other thing I wish is we could just view the cards in a pack if we don’t own them, nothing is stopping me from a 5 second google search to see what it looks like just save me the time please. Apart from those 2 little complaints the games great and I would suggest to friends. :)",Positive
US,3,2025-02-03,1.1.0,fix your issues for real,Wonder energy should be refunded,"The wonder picks that cost 3 or more should refund the difference if you always get a common that would cost only 1 on a different pick. you wait for hours to get three back (once all of them are bought in the shop) then you choose one that cost 3 or more for a chance to get something you want or need, to end up getting something that should only cost 1, give us back two. It’s frustrating to spend that much to get something you usually 99.9% already have, then have to wait days to get enough wonder energy back to try again 

Also coin flips still feel rigged along with the misty card.","Wonder energy should be refundedThe wonder picks that cost 3 or more should refund the difference if you always get a common that would cost only 1 on a different pick. you wait for hours to get three back (once all of them are bought in the shop) then you choose one that cost 3 or more for a chance to get something you want or need, to end up getting something that should only cost 1, give us back two. It’s frustrating to spend that much to get something you usually 99.9% already have, then have to wait days to get enough wonder energy back to try again 

Also coin flips still feel rigged along with the misty card.",Negative
US,2,2025-02-03,1.1.0,PokemonJR,遊戲策劃智商太低,這個遊戲的策劃們能不能動點腦子？？？ 打算撈一筆就走？ 還是打算長久做下去？ 投了300美金＄下去，一張金卡都沒有，你們說那麼用什麼pt換卡，一包5pt，我攢多少才能換一張金卡？ 三星卡存了四五張一點用沒有，拆了只能換點閃亮沙子有什麼用嗎？三星卡存了四五張一點用沒有，拆了只能換點閃亮沙子有什麼用嗎？ 把我們玩家當傻子？ 你看看爐石傳說做的什麼？ 你們做的什麼？ 別說我氣急敗壞，就你們這種智商，也就吃個世界第一大IP的面子，你們到底有沒有搞清楚虛擬卡跟實體卡的區別？ 當虛擬卡比實體卡入手代價更高的時候，玩家為什麼還會選擇你這款遊戲呢？ 吃相可以有，千萬別太難看。 策劃的經濟分析能力很低，等著這遊戲暴死吧！玩了這麼多遊戲沒見過智商這麼低的遊戲策劃。,遊戲策劃智商太低這個遊戲的策劃們能不能動點腦子？？？ 打算撈一筆就走？ 還是打算長久做下去？ 投了300美金＄下去，一張金卡都沒有，你們說那麼用什麼pt換卡，一包5pt，我攢多少才能換一張金卡？ 三星卡存了四五張一點用沒有，拆了只能換點閃亮沙子有什麼用嗎？三星卡存了四五張一點用沒有，拆了只能換點閃亮沙子有什麼用嗎？ 把我們玩家當傻子？ 你看看爐石傳說做的什麼？ 你們做的什麼？ 別說我氣急敗壞，就你們這種智商，也就吃個世界第一大IP的面子，你們到底有沒有搞清楚虛擬卡跟實體卡的區別？ 當虛擬卡比實體卡入手代價更高的時候，玩家為什麼還會選擇你這款遊戲呢？ 吃相可以有，千萬別太難看。 策劃的經濟分析能力很低，等著這遊戲暴死吧！玩了這麼多遊戲沒見過智商這麼低的遊戲策劃。,Neutral
US,1,2025-02-03,1.1.0,Ptcgtrash,Not good for pvp,"Had this game for a few months now it has good cards but at the same time it’s like the game is constantly stacked against you, between ppl using the same strategies and doodoo cards being drawn before the game starts consistently kinda drives ppl away from pvp the only way to enjoy this game is if u only play for a few mins (5-15) mins then the game looses its fun if u want to enjoy the game dont go into a match thinking the cards on your side","Not good for pvpHad this game for a few months now it has good cards but at the same time it’s like the game is constantly stacked against you, between ppl using the same strategies and doodoo cards being drawn before the game starts consistently kinda drives ppl away from pvp the only way to enjoy this game is if u only play for a few mins (5-15) mins then the game looses its fun if u want to enjoy the game dont go into a match thinking the cards on your side",Negative
US,1,2025-02-03,1.1.0,Craftingmario64,terrible in game trading system,greedy trading system do not install,terrible in game trading systemgreedy trading system do not install,Negative
US,1,2025-02-03,1.1.0,Root Beer Enthusiast,Pokémon *TRADING* Card Game? Guess not.,"Imagine you have a car that you use to drive to the grocery store. But in order to drive the car, you must walk to the gas station to fill up a tank and bring it back to the car as it will only start if entirely filled up with gas, you have to pay for “car time” or wait 24 hours before driving again, and you’re banned from using a friend’s car. It’s use is core to your daily life, but so practically prohibitive that you DoorDash expensive meals instead. 

That’s what the “trading system” is in this game. It’s quite incredible how malicious and contrived it is.","Pokémon *TRADING* Card Game? Guess not.Imagine you have a car that you use to drive to the grocery store. But in order to drive the car, you must walk to the gas station to fill up a tank and bring it back to the car as it will only start if entirely filled up with gas, you have to pay for “car time” or wait 24 hours before driving again, and you’re banned from using a friend’s car. It’s use is core to your daily life, but so practically prohibitive that you DoorDash expensive meals instead. 

That’s what the “trading system” is in this game. It’s quite incredible how malicious and contrived it is.",Negative
US,1,2025-02-03,1.1.0,domo_thelegend,Well you ruined it,Was a great game but the newest update for trading ruined it and really shows how greedy the company is. My friend and I both have to burn 4 EX cards just to trade 1 EX card? So that’s 8 rare cards torn up just to receive 1? Especially when there’s no way to farm Trade Tokens? Ridiculous. I was going to rate 5 stars after this update but your greed ruined it.,Well you ruined itWas a great game but the newest update for trading ruined it and really shows how greedy the company is. My friend and I both have to burn 4 EX cards just to trade 1 EX card? So that’s 8 rare cards torn up just to receive 1? Especially when there’s no way to farm Trade Tokens? Ridiculous. I was going to rate 5 stars after this update but your greed ruined it.,Negative
US,5,2025-02-03,1.1.0,l am Nothing,Best game ever,This game is create some really great cards in here. Very good game. Very good game. I love this game. It’s a great game. It’s very entertaining two days of playing it. It’s super fun super super fun thank you guys for making this game. Great game. Keep going.,Best game everThis game is create some really great cards in here. Very good game. Very good game. I love this game. It’s a great game. It’s very entertaining two days of playing it. It’s super fun super super fun thank you guys for making this game. Great game. Keep going.,Positive
US,3,2025-02-03,1.1.0,F.A504,Needs better improvements,"I don’t usually do a review but maybe someone will see this.
The game itself great brings back memories when I used to open Pokémon cards. The bad thing it’s that I want to do some battles and im a level 13 facing people that are level 40+.. like the match making its soon bad makes me not want to battle hopefully they will fix that. 
Other than that game has some cool cards that the art works it’s great.","Needs better improvementsI don’t usually do a review but maybe someone will see this.
The game itself great brings back memories when I used to open Pokémon cards. The bad thing it’s that I want to do some battles and im a level 13 facing people that are level 40+.. like the match making its soon bad makes me not want to battle hopefully they will fix that. 
Other than that game has some cool cards that the art works it’s great.",Positive
US,1,2025-02-03,1.1.0,doshin.psi,"Great Game, Terrible Trade Restrictions","This app has pretty much all you would expect and want from a virtual Pokémon TCG experience. Immersive cards, unique artwork, reasonable pricing and pull rates, etc.

Besides some minor gripes with the community tab and coin flip dependent card battling, I was overall thoroughly impressed. I was very excited for the future of this game until the trading feature was finally revealed.

This thing is USELESS in its current state. Tradable cards are arbitrarily restricted to one star rarity, which means any higher rarity cards you find duplicates of are basically useless and can’t be traded for other rare cards you might be missing.

It’s got “trading” in the name for chrissakes, you’d expect us to be able to trade the cards we pull. Absolutely ridiculous.","Great Game, Terrible Trade RestrictionsThis app has pretty much all you would expect and want from a virtual Pokémon TCG experience. Immersive cards, unique artwork, reasonable pricing and pull rates, etc.

Besides some minor gripes with the community tab and coin flip dependent card battling, I was overall thoroughly impressed. I was very excited for the future of this game until the trading feature was finally revealed.

This thing is USELESS in its current state. Tradable cards are arbitrarily restricted to one star rarity, which means any higher rarity cards you find duplicates of are basically useless and can’t be traded for other rare cards you might be missing.

It’s got “trading” in the name for chrissakes, you’d expect us to be able to trade the cards we pull. Absolutely ridiculous.",Positive
US,1,2025-02-03,1.1.0,Wolf3112,Coin flips are rigged.,"Over 2 hours and I’ve never went first or got a move that requires a coin flip to do damage. How is it a coin that has a 50/50 odds of heads 95% tails? Garbage game honestly, only plus is the gambling addiction fix it gives pulling cards. Battling isn’t worth it unless paying gives better heads odds.","Coin flips are rigged.Over 2 hours and I’ve never went first or got a move that requires a coin flip to do damage. How is it a coin that has a 50/50 odds of heads 95% tails? Garbage game honestly, only plus is the gambling addiction fix it gives pulling cards. Battling isn’t worth it unless paying gives better heads odds.",Negative
US,2,2025-02-03,1.1.0,somachea,A Beautiful But Dull Cash Grab,"The UI, animations and graphics are well-done. However, the events and actual gameplay are mind-numbingly repetitive and boring. The fact that most events are centered around acquiring cards with minor cosmetic changes demonstrates an astounding lack of creativity from the development team.","A Beautiful But Dull Cash GrabThe UI, animations and graphics are well-done. However, the events and actual gameplay are mind-numbingly repetitive and boring. The fact that most events are centered around acquiring cards with minor cosmetic changes demonstrates an astounding lack of creativity from the development team.",Negative
US,5,2025-02-03,1.1.0,minnnners,more cards!!!,we need all the other evolution cards! like GX and vmax and such!,more cards!!!we need all the other evolution cards! like GX and vmax and such!,Positive
US,4,2025-02-03,1.1.0,The reviewer the III,Pay to win,The game seems a little pay to win to get good cards or to open ten packs because it is too difficult to get ten packs by just saving up when others can buy their way to winning and good cards but it would be nice if there was a second wait time for ten packs so it would take 5 days to open a ten pack but at least you could still open them because without spending money you only open one ten pack at the start of the game.,Pay to winThe game seems a little pay to win to get good cards or to open ten packs because it is too difficult to get ten packs by just saving up when others can buy their way to winning and good cards but it would be nice if there was a second wait time for ten packs so it would take 5 days to open a ten pack but at least you could still open them because without spending money you only open one ten pack at the start of the game.,Neutral
US,3,2025-02-03,1.1.0,Dead swagg,It has potential,This game is fun at the very beginning. The solo battles allow you to open a lot of packs. Once those battles are done there really isn’t much to do. Waiting forever to open packs. Versus matches gives you 15 exp for a win. This game needs weekly events and rewards. Better versus rewards. So for this game has shallow depth. Only takes a few hours of gameplay to finish the solo battles.,It has potentialThis game is fun at the very beginning. The solo battles allow you to open a lot of packs. Once those battles are done there really isn’t much to do. Waiting forever to open packs. Versus matches gives you 15 exp for a win. This game needs weekly events and rewards. Better versus rewards. So for this game has shallow depth. Only takes a few hours of gameplay to finish the solo battles.,Positive
