Country,Rating,Date,Version,Username,Title,Content,Combined,Sentiment
US,2,2025-02-05,1.1.0,TGromps,Dev’s not making changes/QoL,"Personally not a fan of apps never making request changes, especially QoL ones. Still no Dark Mode, trading can only be done if you destroy Holos/3diamond rares, ex cards, and art rare cards ( ex: one ex trade requires BOTH sides to sacrifice 20 holos each or at least four ex cards/art rares). I’ve been playing with a subscription since pretty early on and the expectation of how many duplicates needed to be sacrificed in one trade is absurd. 
Flipping coins for paralysis/status effects when the pokemon is dead/0hp, battle events are just win 5 in a row or 45 total so they’re just grinds and not very reflective of your strategy/knowledge, Profile Card Displays are shown with the card minimized outside of the Display Case as if it’s an item in a menu and NOT in any way an actual Display of the card on your profile, 15 decks can only be made which the more you battle and open packs the more you understand how awful it is, flares must be manually and individually put on every time you make your 20 card decks so you end up just not wanting to even use them, the visual card overlay flares ONLY appear for 1 second when you put your card onto the field or use its attacks/abilities (so they’re un-flared the entire match on the playmat), binder/display flares show a static image unless you click on them to ‘observe’ them up close, you can’t report other players in-game for inappropriate names (which I highly suggest as a feature in anything kids play as well), you can’t buy multiples of anything in the shop/event shops in one transaction, you have to keep buying things over and over till it’s out, only 3 of the tons (and more to come) badges can be displayed on your profile, the profile trophies only give 30-100 stardust (I have 43,500 stardust, if you ever can win 10,000 pvp matches you’re getting 100 stardust for it), can only open one promo pack at a time, once you get five shop tickets for the day any other ‘Thanks’ you get just give you a notification mark and you can collect them all but they do nothing, there are not many icons in the game so you just all sorta have the same fiveish and that heavily contributes to the lack of profile/individuality in the game (but they ARE ADDING MORE! So credit to that! Would be nice if it was just any card you had could be your profile pic!), and there’s an odd amount of small time-wasting; can’t use or do anything after using pokeball or anything that makes the deck shuffle, post game screen has three pages of odd stats that don’t really matter to either parties (including a screen that only tells you that you don’t get anything for losing) then they place the thanks button suddenly above the next button so if you’re clicking through your pages you accidentally don’t thank them and just leave the page. 

It’s a ton of these small things that in other games devs will see themselves or hear about and then fix, but this game the only thing I’ve seen slightly assessed from the devs was that THEY will handle to inappropriate names… no report button needed apparently, yet I still run into them… I’m not sure why at bare minimum dark mode isn’t here.. Games where developers are like this are just soul-less to me, with the saving grace being the beautiful card illustrations. Clearly, with how much profits they made within the first DAY of this games release, they don’t seem to care. The less you care about this game the better; just log on, get your free packs, and close it.","Dev’s not making changes/QoLPersonally not a fan of apps never making request changes, especially QoL ones. Still no Dark Mode, trading can only be done if you destroy Holos/3diamond rares, ex cards, and art rare cards ( ex: one ex trade requires BOTH sides to sacrifice 20 holos each or at least four ex cards/art rares). I’ve been playing with a subscription since pretty early on and the expectation of how many duplicates needed to be sacrificed in one trade is absurd. 
Flipping coins for paralysis/status effects when the pokemon is dead/0hp, battle events are just win 5 in a row or 45 total so they’re just grinds and not very reflective of your strategy/knowledge, Profile Card Displays are shown with the card minimized outside of the Display Case as if it’s an item in a menu and NOT in any way an actual Display of the card on your profile, 15 decks can only be made which the more you battle and open packs the more you understand how awful it is, flares must be manually and individually put on every time you make your 20 card decks so you end up just not wanting to even use them, the visual card overlay flares ONLY appear for 1 second when you put your card onto the field or use its attacks/abilities (so they’re un-flared the entire match on the playmat), binder/display flares show a static image unless you click on them to ‘observe’ them up close, you can’t report other players in-game for inappropriate names (which I highly suggest as a feature in anything kids play as well), you can’t buy multiples of anything in the shop/event shops in one transaction, you have to keep buying things over and over till it’s out, only 3 of the tons (and more to come) badges can be displayed on your profile, the profile trophies only give 30-100 stardust (I have 43,500 stardust, if you ever can win 10,000 pvp matches you’re getting 100 stardust for it), can only open one promo pack at a time, once you get five shop tickets for the day any other ‘Thanks’ you get just give you a notification mark and you can collect them all but they do nothing, there are not many icons in the game so you just all sorta have the same fiveish and that heavily contributes to the lack of profile/individuality in the game (but they ARE ADDING MORE! So credit to that! Would be nice if it was just any card you had could be your profile pic!), and there’s an odd amount of small time-wasting; can’t use or do anything after using pokeball or anything that makes the deck shuffle, post game screen has three pages of odd stats that don’t really matter to either parties (including a screen that only tells you that you don’t get anything for losing) then they place the thanks button suddenly above the next button so if you’re clicking through your pages you accidentally don’t thank them and just leave the page. 

It’s a ton of these small things that in other games devs will see themselves or hear about and then fix, but this game the only thing I’ve seen slightly assessed from the devs was that THEY will handle to inappropriate names… no report button needed apparently, yet I still run into them… I’m not sure why at bare minimum dark mode isn’t here.. Games where developers are like this are just soul-less to me, with the saving grace being the beautiful card illustrations. Clearly, with how much profits they made within the first DAY of this games release, they don’t seem to care. The less you care about this game the better; just log on, get your free packs, and close it.",Negative
US,1,2025-02-05,1.1.0,whoneedbag,Trading system is a complete miss,"Was really looking forward to this but it’s way too restrictive. Can’t trade new cards, can’t trade anything above a 1 star, and it’s limited by ANOTHER currency. Could use a lot of work","Trading system is a complete missWas really looking forward to this but it’s way too restrictive. Can’t trade new cards, can’t trade anything above a 1 star, and it’s limited by ANOTHER currency. Could use a lot of work",Negative
US,3,2025-02-05,1.1.0,OverlyVerbose1,New trade system is abysmal,"The trade system is godawful. It’s somehow both too expensive for normal players and too restrictive for those who splash large amounts of money on the game. The conversion rate on the trade currency means that, unless you only want to trade commons that pretty much everyone already has, you have to have a whale-like amount of rares to throw away. But that itself is an issue, since if you have that many rares, you most likely have every card and would have no use for trading (this is made worse by the fact that the very rare cards that whales would trade for can’t be traded). It’s a system that has an identity crisis. It can’t help casual players fill out their decklists and it can’t help whales hunt down the rare cards they don’t yet have. Which leads to the obvious question: who *is* it for? *edit: apparently they’re “continuing to consider the possibility of improving the trading function,” as stated on their social media (as translated from Japanese, so may not be their exact wording), and in the meantime they’ve gifted 1000 trade tokens, or about two EX/star trades, to go along with the previous 500 token gift. Not to sound like a miser, but this gift and/or fix seems… a little anemic. Hopefully it’s a sign that they’re going to adjust prices to be less absurd, but I’m not holding my breath on that front.","New trade system is abysmalThe trade system is godawful. It’s somehow both too expensive for normal players and too restrictive for those who splash large amounts of money on the game. The conversion rate on the trade currency means that, unless you only want to trade commons that pretty much everyone already has, you have to have a whale-like amount of rares to throw away. But that itself is an issue, since if you have that many rares, you most likely have every card and would have no use for trading (this is made worse by the fact that the very rare cards that whales would trade for can’t be traded). It’s a system that has an identity crisis. It can’t help casual players fill out their decklists and it can’t help whales hunt down the rare cards they don’t yet have. Which leads to the obvious question: who *is* it for? *edit: apparently they’re “continuing to consider the possibility of improving the trading function,” as stated on their social media (as translated from Japanese, so may not be their exact wording), and in the meantime they’ve gifted 1000 trade tokens, or about two EX/star trades, to go along with the previous 500 token gift. Not to sound like a miser, but this gift and/or fix seems… a little anemic. Hopefully it’s a sign that they’re going to adjust prices to be less absurd, but I’m not holding my breath on that front.",Negative
US,1,2025-02-05,1.1.0,carnagee831,Trading basically non existent,Trading is horrible? With the current system I don’t think I will ever even trade with anyone,Trading basically non existentTrading is horrible? With the current system I don’t think I will ever even trade with anyone,Negative
US,1,2025-02-05,1.1.0,Kyleliterally,Fix Trading,If you fix trading like you say you will I’ll change my review. There are easier ways to stop bots then making us jump through hoops to trade,Fix TradingIf you fix trading like you say you will I’ll change my review. There are easier ways to stop bots then making us jump through hoops to trade,Neutral
US,1,2025-02-05,1.1.0,YungMozzy,Be prepared to pay money,"The only Card they care about is the Credit Card.

I am a day 1 player and it will be impossible for new players to casually enjoy the game without spending money. 

Also, it is a trading card game. Trading is in the name. Why do they charge so much to trade cards? So you are forced to buy them instead.","Be prepared to pay moneyThe only Card they care about is the Credit Card.

I am a day 1 player and it will be impossible for new players to casually enjoy the game without spending money. 

Also, it is a trading card game. Trading is in the name. Why do they charge so much to trade cards? So you are forced to buy them instead.",Negative
US,2,2025-02-05,1.1.0,Black Friday24,Unfair match making,The game will match you with players who claim to be beginners but have a great deck. Often times it’s a level 30+ as I’m level 14 with maybe 300 cards. It would make more sense to have players face against bots to encourage them and to level up. Not keen of taking L after L when we are all decent Pokémon players.,Unfair match makingThe game will match you with players who claim to be beginners but have a great deck. Often times it’s a level 30+ as I’m level 14 with maybe 300 cards. It would make more sense to have players face against bots to encourage them and to level up. Not keen of taking L after L when we are all decent Pokémon players.,Neutral
US,1,2025-02-05,1.1.0,MathematicallyBadLuck,They (🍏)delete negative reviews.,"The luck of the game is statistically unlikely, in a bad way. Luck stat 1 and only 10 when it doesn’t matter.","They (🍏)delete negative reviews.The luck of the game is statistically unlikely, in a bad way. Luck stat 1 and only 10 when it doesn’t matter.",Negative
US,4,2025-02-05,1.1.0,Josh 2157,Great game,"Amazing game all I could ask for is that the pack points exchange thing worked so all points can be used for any pack instead of just for the one you got them in such as I have 1500 pack points for genetic apex but I have no use for them as I have most of the cards that are available for that pack, but if I could use them in a newer pack it could help me complete my collection","Great gameAmazing game all I could ask for is that the pack points exchange thing worked so all points can be used for any pack instead of just for the one you got them in such as I have 1500 pack points for genetic apex but I have no use for them as I have most of the cards that are available for that pack, but if I could use them in a newer pack it could help me complete my collection",Positive
US,1,2025-02-05,1.1.0,Perfect crashing game,If you can’t pay you can’t play.,"Unless you are wealthy or a content creator, you can’t play this game. Free to play, the average person or kids will be unable to play the card game against the players that are able to spend hundreds on cards and decks. Once again The Pokemon Company International has promoted wealth and cash flow over allowing players to be allowed to play the game. Good Luck. Pokémon Company International just lost a life long fan and my kids who were getting into it for life. I know this won’t affect them or the people that will be dooped into playing this but just a warning. They should be ashamed of what they’ve turned Pokémon into.","If you can’t pay you can’t play.Unless you are wealthy or a content creator, you can’t play this game. Free to play, the average person or kids will be unable to play the card game against the players that are able to spend hundreds on cards and decks. Once again The Pokemon Company International has promoted wealth and cash flow over allowing players to be allowed to play the game. Good Luck. Pokémon Company International just lost a life long fan and my kids who were getting into it for life. I know this won’t affect them or the people that will be dooped into playing this but just a warning. They should be ashamed of what they’ve turned Pokémon into.",Negative
US,5,2025-02-05,1.1.0,hugughtu,I love this game,"I take back my previous statement of this game being bad (totally not because I pulled a gold dialga on my first pack). But seriously, the card pulling aspect is amazing, the gameplay can be amazing and exciting, or make we want to break my phone, which is my problem so I don’t blame the game. And the free packs, hourglasses, new cards, competitive decks, constant updates, and new content keeps the game fresh and shows how much work goes in to the games production. And don’t get me started on the rainbow border Infernape art, good god it’s good.","I love this gameI take back my previous statement of this game being bad (totally not because I pulled a gold dialga on my first pack). But seriously, the card pulling aspect is amazing, the gameplay can be amazing and exciting, or make we want to break my phone, which is my problem so I don’t blame the game. And the free packs, hourglasses, new cards, competitive decks, constant updates, and new content keeps the game fresh and shows how much work goes in to the games production. And don’t get me started on the rainbow border Infernape art, good god it’s good.",Positive
US,5,2025-02-05,1.1.0,La cracks,The best game,The game is so much fun I can’t even go a second with out it.best game ever you here’d,The best gameThe game is so much fun I can’t even go a second with out it.best game ever you here’d,Positive
US,1,2025-02-05,1.1.0,Alberto B 14,Bad update,Game was fun until the new update. Pay to win and if you don’t have the newest meta cards you’re out of luck. Made every other card and deck irrelevant and it’s impossible to compete. Gg,Bad updateGame was fun until the new update. Pay to win and if you don’t have the newest meta cards you’re out of luck. Made every other card and deck irrelevant and it’s impossible to compete. Gg,Neutral
US,2,2025-02-05,1.1.0,Notmyrealname12321,Trading is bad,Trading cost 5 ex to have enough currency to make one trade transaction. Trading helps neither new nor day one players. Games crash and cause losses when you switch out gengar ex. Re do trading and fix crashes that causes losses and I’ll change the review.,Trading is badTrading cost 5 ex to have enough currency to make one trade transaction. Trading helps neither new nor day one players. Games crash and cause losses when you switch out gengar ex. Re do trading and fix crashes that causes losses and I’ll change the review.,Negative
US,1,2025-02-05,1.1.0,sportscrazy467,Trading,Trading is horrible,TradingTrading is horrible,Negative
US,1,2025-02-05,1.1.0,yunamay314,Matchmaking is terrible,Pay to win game. Unbalance. No rewards for playing pvp.,Matchmaking is terriblePay to win game. Unbalance. No rewards for playing pvp.,Negative
US,1,2025-02-05,1.1.0,Casual Yakker,"Highly Irritating, and rigged","Original review below. 

TLDR: this game is a money grab for nostalgic millennials. It’s too slow, and too biased towards exorbitantly expensive pay-to-play, and the game odds are manipulated. 

Additions: 

Changed to 1 star because the in-game purchases are predatory. If you spend real money to get gold, the gold cost of “ten packs” will increase, forcing you to purchase more to try and afford it. Not okay. 

The versus battling has nothing to help casual players. There are 2-3 toxic deck strategies that are used by the majority of players online, making battling extremely un-fun and difficult to progress, which is painful because versus is the only way to consistently gain experience points and progress. 

Trading is completely unusable. The barrier of entry is so high, that the average player can only afford to do a few trades period. 

The booster pack pull rate odds are manipulated. They boost them at random times to get you addicted pull them back to get you to pay for more packs. 

—-
Let me start out by saying I absolutely adore this game. I will be a player for the foreseeable future.

That said, the reward system needs rebalancing, and the coin flip odds are not 50/50. 

First, many of the rewards you receive can only be exchanged for things that don’t help you advance in the game. Second, there are many things that do not give you experience that logically should, making it difficult to progress. Third, there are not enough ways to earn pack hourglasses after you reach a certain point in the game. I used to be able to open 5–6 packs per day, now I can only open the one or two given each day because I have cleared all of the solo battles that give pack hourglasses.

On the coin flip subject, certain cards appear to have different odds. Additionally, the very first coin flip dramatically influences the rest of your results. If you get heads first, you often get mostly heads. If you get tails first, often times you get all tails. Very irritating.","Highly Irritating, and riggedOriginal review below. 

TLDR: this game is a money grab for nostalgic millennials. It’s too slow, and too biased towards exorbitantly expensive pay-to-play, and the game odds are manipulated. 

Additions: 

Changed to 1 star because the in-game purchases are predatory. If you spend real money to get gold, the gold cost of “ten packs” will increase, forcing you to purchase more to try and afford it. Not okay. 

The versus battling has nothing to help casual players. There are 2-3 toxic deck strategies that are used by the majority of players online, making battling extremely un-fun and difficult to progress, which is painful because versus is the only way to consistently gain experience points and progress. 

Trading is completely unusable. The barrier of entry is so high, that the average player can only afford to do a few trades period. 

The booster pack pull rate odds are manipulated. They boost them at random times to get you addicted pull them back to get you to pay for more packs. 

—-
Let me start out by saying I absolutely adore this game. I will be a player for the foreseeable future.

That said, the reward system needs rebalancing, and the coin flip odds are not 50/50. 

First, many of the rewards you receive can only be exchanged for things that don’t help you advance in the game. Second, there are many things that do not give you experience that logically should, making it difficult to progress. Third, there are not enough ways to earn pack hourglasses after you reach a certain point in the game. I used to be able to open 5–6 packs per day, now I can only open the one or two given each day because I have cleared all of the solo battles that give pack hourglasses.

On the coin flip subject, certain cards appear to have different odds. Additionally, the very first coin flip dramatically influences the rest of your results. If you get heads first, you often get mostly heads. If you get tails first, often times you get all tails. Very irritating.",Negative
US,1,2025-02-05,1.1.0,Pokemon player here,I hate apps that tell me what to do.,I hate apps that tell me how to spend my point and force me through a walkthrough and spend them . I think this app is a money grab. The old app actually had you learn the cards and how to use them . This app is just a a polished piece of trash so far .,I hate apps that tell me what to do.I hate apps that tell me how to spend my point and force me through a walkthrough and spend them . I think this app is a money grab. The old app actually had you learn the cards and how to use them . This app is just a a polished piece of trash so far .,Negative
