Country,Rating,Date,Version,Username,Title,Content,Combined,Sentiment
US,5,2025-02-05,1.1.0,henry sayner,"Love this game, but two critiques",First off love this game it’s simple does not try to be anything flashy and is exactly what it advises. However there are two issues with the game that need to be fixed. First there is no true reward for playing the random battles after completing the solo battle as you can only get 15 exp per battle won and a skip ticket if the other player thanks you. This system would be fine if there wasn’t a level cap and skip ticket actually were able to be used on hour glasses more than once a month (10 individual hourglass and 40 multiple hour glasses). If you’re going to have skip tickets and hour glasses at least make the shop refresh 2 weeks instead of a month. Also maybe add like a three win reward in battles that gives an hour glass as reward or the potential for one.,"Love this game, but two critiquesFirst off love this game it’s simple does not try to be anything flashy and is exactly what it advises. However there are two issues with the game that need to be fixed. First there is no true reward for playing the random battles after completing the solo battle as you can only get 15 exp per battle won and a skip ticket if the other player thanks you. This system would be fine if there wasn’t a level cap and skip ticket actually were able to be used on hour glasses more than once a month (10 individual hourglass and 40 multiple hour glasses). If you’re going to have skip tickets and hour glasses at least make the shop refresh 2 weeks instead of a month. Also maybe add like a three win reward in battles that gives an hour glass as reward or the potential for one.",Neutral
US,5,2025-02-05,1.1.0,SeaFisher1900,Trading needs a few changes to make a little easier,"I love the game it super fun to play and all but the new trading system is broken 
For starters their shouldn’t be a limit to how much you can trade
It’s not the worst to only trade with friends but I think there should be a wonder trade and/or link trade mode as well
The only other thing is I think for randomized trades it makes sense to only trade the same rarity of cards but that shouldn’t apply to friends because if somebody thinks a trade is unfair then all they need to do is stop the trade","Trading needs a few changes to make a little easierI love the game it super fun to play and all but the new trading system is broken 
For starters their shouldn’t be a limit to how much you can trade
It’s not the worst to only trade with friends but I think there should be a wonder trade and/or link trade mode as well
The only other thing is I think for randomized trades it makes sense to only trade the same rarity of cards but that shouldn’t apply to friends because if somebody thinks a trade is unfair then all they need to do is stop the trade",Positive
US,2,2025-02-05,1.1.0,eknyu,great concept and potential but has to grow,love everything about the game but there are too many quality of life things that can be changed; whether or not they can cater the game toward those who love it or continue pandering it as a cash grab with repetitive gameplay loops and lack of trading potential will tank its longevity,great concept and potential but has to growlove everything about the game but there are too many quality of life things that can be changed; whether or not they can cater the game toward those who love it or continue pandering it as a cash grab with repetitive gameplay loops and lack of trading potential will tank its longevity,Neutral
US,1,2025-02-05,1.1.0,Benjamin Disraeli MiYarusalim,Trading is bad,Amazing game but trading is so bad. Just set a high level minimum or find another solution to stop re-starting alt accounts. Or just keep the high cost and make trading universal and less restricted.,Trading is badAmazing game but trading is so bad. Just set a high level minimum or find another solution to stop re-starting alt accounts. Or just keep the high cost and make trading universal and less restricted.,Negative
US,5,2025-02-05,1.1.0,Camii_14,Love it,Awesome work!,Love itAwesome work!,Positive
US,5,2025-02-05,1.1.0,CWT59,This is so much fun,"If you love Pokémon, this is the game to go to. I think that this game will become like NFT’s and you will be able to sell these for money and the battling is pretty fun. I love this game10 out of 10. and with friends, it’s amazing.","This is so much funIf you love Pokémon, this is the game to go to. I think that this game will become like NFT’s and you will be able to sell these for money and the battling is pretty fun. I love this game10 out of 10. and with friends, it’s amazing.",Positive
US,3,2025-02-05,1.1.0,BigBody00,COIN FLIPS,"My BIGGEST and only real concern with the game is these rigged garbage coin flips! 
When I’m flipping coins upwards of 15 times a game and consistently only getting 3-4 heads out of it, something is wrong. You can swear until your purple that the coin flips are random. They ARE NOT. They are heavily leaned tails and it’s ruining your game. If anything patch it so that I flip them all manually instead of the game taking over after the first flip!","COIN FLIPSMy BIGGEST and only real concern with the game is these rigged garbage coin flips! 
When I’m flipping coins upwards of 15 times a game and consistently only getting 3-4 heads out of it, something is wrong. You can swear until your purple that the coin flips are random. They ARE NOT. They are heavily leaned tails and it’s ruining your game. If anything patch it so that I flip them all manually instead of the game taking over after the first flip!",Negative
US,3,2025-02-05,1.1.0,Quadfftcsjj,The battle system is trash,"The battle system consist of beginner mode and TCG player mode but regardless I feel as if this system is based off luck then actually skill, by moving or limiting cards you need to use to win.","The battle system is trashThe battle system consist of beginner mode and TCG player mode but regardless I feel as if this system is based off luck then actually skill, by moving or limiting cards you need to use to win.",Negative
US,1,2025-02-05,1.1.0,omgnickbames,"Huge potential, huge let down","The game is pretty fun and collecting cards is of course addicting but the format for trading is just awful. It’s clear the game doesn’t want you to trade and only wants you to dump money into the game. 

Also, the battling format makes 90% of the cards in the game absolutely worthless.

Download it, open your free pack every 12 hours, and move on. The game is a dud.","Huge potential, huge let downThe game is pretty fun and collecting cards is of course addicting but the format for trading is just awful. It’s clear the game doesn’t want you to trade and only wants you to dump money into the game. 

Also, the battling format makes 90% of the cards in the game absolutely worthless.

Download it, open your free pack every 12 hours, and move on. The game is a dud.",Negative
US,4,2025-02-05,1.1.0,ushfg jsndhxjsnduxjz,Packs,"I’ve been playing this game non-stop ever since I got it and love it so much!! One thing I’d say they could change is the cooldown time for opening packs, in my opinion 12 hours for one pack is a little bit to much time but if they moved it down to maybe 6 or 8 hours than I would have no complaints:)","PacksI’ve been playing this game non-stop ever since I got it and love it so much!! One thing I’d say they could change is the cooldown time for opening packs, in my opinion 12 hours for one pack is a little bit to much time but if they moved it down to maybe 6 or 8 hours than I would have no complaints:)",Positive
US,4,2025-02-05,1.1.0,KBW•34,"Love the game, but trading makes no sense","Honestly i’m addicted to this game it brings me back nostalgia from opening packs when i was little. I just love opening packs and getting an amazing card. Some of the artwork on the cards are amazing. I have been playing sonar the game came out and i was excited to see trading coming out soon! The day trading came out I was deeply saddened when trading finally came. It makes no sense to trade up to certain rarities, I am personally annoyed because my favorite pokémon Blastoise has a card passed the trading rarity and i’m yet to obtain it so it’s annoying to get. Also the trading currency makes no sense, it’s hard to obtain and should be replaced by shine dust. Overall it’s a really great game and i enjoy playing it but i wished the changed trading.","Love the game, but trading makes no senseHonestly i’m addicted to this game it brings me back nostalgia from opening packs when i was little. I just love opening packs and getting an amazing card. Some of the artwork on the cards are amazing. I have been playing sonar the game came out and i was excited to see trading coming out soon! The day trading came out I was deeply saddened when trading finally came. It makes no sense to trade up to certain rarities, I am personally annoyed because my favorite pokémon Blastoise has a card passed the trading rarity and i’m yet to obtain it so it’s annoying to get. Also the trading currency makes no sense, it’s hard to obtain and should be replaced by shine dust. Overall it’s a really great game and i enjoy playing it but i wished the changed trading.",Positive
US,1,2025-02-05,1.1.0,LordInri,Fix Trading,"Fix trading plz, no reason why we need to spend a currency for trading with our friends/family. It shouldn’t bother you as a multibillion dollar company if our friends cares enough to throw us a free rare card for a bad card in return, because that’s how you grow a nurturing community you greedy scums.","Fix TradingFix trading plz, no reason why we need to spend a currency for trading with our friends/family. It shouldn’t bother you as a multibillion dollar company if our friends cares enough to throw us a free rare card for a bad card in return, because that’s how you grow a nurturing community you greedy scums.",Negative
US,2,2025-02-05,1.1.0,BigBoy22428,Trading is abysmal!,This new space/time set has treated all of my friends with fantastic pulls and given me basically garbage. My friends want to help me but for some reason your stupid trading system doesn’t allow cards from the newest set to be traded. Trading is atrocious and needs to be fixed immediately!,Trading is abysmal!This new space/time set has treated all of my friends with fantastic pulls and given me basically garbage. My friends want to help me but for some reason your stupid trading system doesn’t allow cards from the newest set to be traded. Trading is atrocious and needs to be fixed immediately!,Negative
US,2,2025-02-05,1.1.0,The Spid,It’s okay,My biggest gripe is the clunky UI. I shouldn’t need to tap more than once after opening a pack or claiming things like it’s not smooth at all. You can put all the card adding stuff on one screen and make it only one tap. Like I’m killing enough time already and there’s only so much you can do in the app everyday. Doubt this will get fixed with all the other good reviews but if it does I will change review.,It’s okayMy biggest gripe is the clunky UI. I shouldn’t need to tap more than once after opening a pack or claiming things like it’s not smooth at all. You can put all the card adding stuff on one screen and make it only one tap. Like I’m killing enough time already and there’s only so much you can do in the app everyday. Doubt this will get fixed with all the other good reviews but if it does I will change review.,Negative
US,5,2025-02-05,1.1.0,Awab. Mohab,You are nice to us,1000/1,You are nice to us1000/1,Positive
US,1,2025-02-05,1.1.0,sophiachen74,Should rename to Pokemon cannot trade card game,The greed is real.,Should rename to Pokemon cannot trade card gameThe greed is real.,Negative
US,3,2025-02-05,1.1.0,Rex1226!,"Love it, but… Trading isn’t good whatsoever","The base game, events, and all the in between are great, and worth your time! However… seeing how absolutely fumbled the trading is just sorta brings it all down for me. You can’t trade too freely, can’t trade the most recent packs, and you *HAVE* to talk outside of the game to even try to get what you want since the game itself offers zero ways to chat with friends. It’s just such a bummer that part of it is so subpar.","Love it, but… Trading isn’t good whatsoeverThe base game, events, and all the in between are great, and worth your time! However… seeing how absolutely fumbled the trading is just sorta brings it all down for me. You can’t trade too freely, can’t trade the most recent packs, and you *HAVE* to talk outside of the game to even try to get what you want since the game itself offers zero ways to chat with friends. It’s just such a bummer that part of it is so subpar.",Negative
US,2,2025-02-05,1.1.0,7on7on,Coin flip-to-win,"The free-to-play and in-game currency are very generous. The most frustrating element is that a lot of cards use a coin flip that makes or breaks a match. 

If an achievement calls for “Don’t lose points in a game” and have the decks include cards like Exeggutor with 80 damage for one energy, you’re at the mercy of chance no matter how well you made your deck or versed you are with the OG card game. I played matches over and over and over and it takes it reduces it down to getting with coin flips just to get that achievement. As a completionist player, this is a terrible experience. 

Turn order dictates energy advantage, also a coin flip. Why can’t you attach an energy on the first turn? Just don’t let them attack on the first turn, similar to the OG game. 

A lot of the cards have this feature as if there are no other ways to balance the cards. This game is for casual players. No means to be competitive, just pretty to look at.","Coin flip-to-winThe free-to-play and in-game currency are very generous. The most frustrating element is that a lot of cards use a coin flip that makes or breaks a match. 

If an achievement calls for “Don’t lose points in a game” and have the decks include cards like Exeggutor with 80 damage for one energy, you’re at the mercy of chance no matter how well you made your deck or versed you are with the OG card game. I played matches over and over and over and it takes it reduces it down to getting with coin flips just to get that achievement. As a completionist player, this is a terrible experience. 

Turn order dictates energy advantage, also a coin flip. Why can’t you attach an energy on the first turn? Just don’t let them attack on the first turn, similar to the OG game. 

A lot of the cards have this feature as if there are no other ways to balance the cards. This game is for casual players. No means to be competitive, just pretty to look at.",Negative
US,5,2025-02-05,1.1.0,Jerry selford,Best Pokémon game!,This game is the best game for any Pokémon fan.,Best Pokémon game!This game is the best game for any Pokémon fan.,Positive
US,1,2025-02-05,1.1.0,jajbskns,Greedy company,"Trading system is so obviously busted because of how much resources it takes to trade. In-game currency is far too expensive even for the US, so I couldn’t imagine players from other countries trying to keep up with the game. Until you guys fix trading, 1 star review will stay.","Greedy companyTrading system is so obviously busted because of how much resources it takes to trade. In-game currency is far too expensive even for the US, so I couldn’t imagine players from other countries trying to keep up with the game. Until you guys fix trading, 1 star review will stay.",Negative
US,1,2025-02-05,1.1.0,Francesco luminati,Rigged battles,"The battles are rigged, it’s very frustrating to know that every time you battle the games algorithm decides if you win or lose.. the only good aspect about this game is collecting Pokémon cards.. add more features, make the game more entertaining when it comes to objectives and make battles completely random.","Rigged battlesThe battles are rigged, it’s very frustrating to know that every time you battle the games algorithm decides if you win or lose.. the only good aspect about this game is collecting Pokémon cards.. add more features, make the game more entertaining when it comes to objectives and make battles completely random.",Negative
US,4,2025-02-05,1.1.0,VinnyM34,The only thing that needs be changed is that people at level 30-45 or even higher,They still can battle at beginner it’s wild level 16 vs a level 30 35 or 43 it’s just unfair,The only thing that needs be changed is that people at level 30-45 or even higherThey still can battle at beginner it’s wild level 16 vs a level 30 35 or 43 it’s just unfair,Negative
US,5,2025-02-05,1.1.0,STkniffin,Fun,Great concept to an already fun game,FunGreat concept to an already fun game,Positive
US,1,2025-02-05,1.1.0,PosGametcg,Waste of Time,"What a shocker another big name in gaming released a yet another title with predatory mechanics and piss poor RNG. One of the most unsatisfying apps I’ve had the pleasure of downloading. 12 hours in between opening packs just to be meet with the same 5 cards I already pulled. What’s that? You want to play against people? Let me save you the time, everyone you match against has swiped their credit card, maxed out their Mom’s allowance, and dipped into personal savings just so that they can play with the newest, shiniest, bestest cards. Then let’s say by some miracle you don’t match make with someone with a 100% Pokédex, you’re met with the horrid rng mechanics of a “coin flip” which clearly has been needed the longer the card has been in the game. So let’s say you don’t enjoy online play, you want to test your deck against Ai in Solo Battles. Well be prepared for the same array of onslaught from the AI in this game, what’s that? You thought just because the difficulty went up from beginner to expert that the AI would behave differently? Nope! They just repeat the same order of cards every time! They aren’t even trying to hide it. Every battle with Expert level AI leads to them drawing and playing their whole assortment of Pokémon and respective evolution line within the first turn, while your left there with one base level Ratatouille and 4 useless support cards. This game is really shameless and is an absolute joke to anyone who wants a polished version of a Pokémon tcg.","Waste of TimeWhat a shocker another big name in gaming released a yet another title with predatory mechanics and piss poor RNG. One of the most unsatisfying apps I’ve had the pleasure of downloading. 12 hours in between opening packs just to be meet with the same 5 cards I already pulled. What’s that? You want to play against people? Let me save you the time, everyone you match against has swiped their credit card, maxed out their Mom’s allowance, and dipped into personal savings just so that they can play with the newest, shiniest, bestest cards. Then let’s say by some miracle you don’t match make with someone with a 100% Pokédex, you’re met with the horrid rng mechanics of a “coin flip” which clearly has been needed the longer the card has been in the game. So let’s say you don’t enjoy online play, you want to test your deck against Ai in Solo Battles. Well be prepared for the same array of onslaught from the AI in this game, what’s that? You thought just because the difficulty went up from beginner to expert that the AI would behave differently? Nope! They just repeat the same order of cards every time! They aren’t even trying to hide it. Every battle with Expert level AI leads to them drawing and playing their whole assortment of Pokémon and respective evolution line within the first turn, while your left there with one base level Ratatouille and 4 useless support cards. This game is really shameless and is an absolute joke to anyone who wants a polished version of a Pokémon tcg.",Negative
US,4,2025-02-05,1.1.0,Sohm Rana,Great game that could use some tweaks,"The game is very good, but I wish that they didn’t remove the genetic apex pack, I do not grind the game, so I was not able to finish genetic ape , so I wish they would bring it back 😊","Great game that could use some tweaksThe game is very good, but I wish that they didn’t remove the genetic apex pack, I do not grind the game, so I was not able to finish genetic ape , so I wish they would bring it back 😊",Positive
US,1,2025-02-05,1.1.0,filter312,Pay to win,if u dont buy gold your odds are lowered in battle had the equivalent of 8 energy on a celebi and 3 turns in a row only hit 1-2 heads that is not 50-50 odds that is programmed,Pay to winif u dont buy gold your odds are lowered in battle had the equivalent of 8 energy on a celebi and 3 turns in a row only hit 1-2 heads that is not 50-50 odds that is programmed,Neutral
US,2,2025-02-05,1.1.0,0mmnommm,Nostalgic but too many currencies and trading is prohibitive,"The nostalgia of opening and collecting cards is fun! The social aspect could be better but our group text is strong.

Too many currencies in game though. It’s a lot to learn at first between hourglasses, wonder hearts, trade stamina.

Trading is ridiculous and unusable. I think even rarity trades is fair and easy for the common cards. Rare cards? Forgot it. The tokens required to make a trade mean I have to sacrifice 5 rare cards I struggled to get to trade for 1 rare card I am *really* struggling to get. No point bothering.","Nostalgic but too many currencies and trading is prohibitiveThe nostalgia of opening and collecting cards is fun! The social aspect could be better but our group text is strong.

Too many currencies in game though. It’s a lot to learn at first between hourglasses, wonder hearts, trade stamina.

Trading is ridiculous and unusable. I think even rarity trades is fair and easy for the common cards. Rare cards? Forgot it. The tokens required to make a trade mean I have to sacrifice 5 rare cards I struggled to get to trade for 1 rare card I am *really* struggling to get. No point bothering.",Negative
US,5,2025-02-05,1.1.0,afrenchfry,Really fun,It would be a cool feature to add to the trading system to request certain cards to our friends. Otherwise fun and easy to get into,Really funIt would be a cool feature to add to the trading system to request certain cards to our friends. Otherwise fun and easy to get into,Positive
US,3,2025-02-05,1.1.0,Plad O,Need Dark Mode,Will give 5 stars for Dark Mode,Need Dark ModeWill give 5 stars for Dark Mode,Neutral
US,3,2025-02-05,1.1.0,NeedAFreshNickname,The TCG that doesn’t let you trade,This game is a joke! So many limitations on card trading! Enough said.,The TCG that doesn’t let you tradeThis game is a joke! So many limitations on card trading! Enough said.,Negative
US,1,2025-02-05,1.1.0,Camping beast,Same deck in every vs match,Everyone uses the exact same thing in vs. snivey with a celebi. It’s unstoppable. Game is a joke,Same deck in every vs matchEveryone uses the exact same thing in vs. snivey with a celebi. It’s unstoppable. Game is a joke,Neutral
US,1,2025-02-05,1.1.0,BigMikey313,Neutral,Very quickly becoming a pay to win game!,NeutralVery quickly becoming a pay to win game!,Positive
US,1,2025-02-05,1.1.0,Meh I don't like u,Waste of time and money,Horrible game and just a gotcha garbage money pit,Waste of time and moneyHorrible game and just a gotcha garbage money pit,Negative
US,1,2025-02-05,1.1.0,Username012005,Thought i liked this game but trading is broken,"This game is easy to love at first but the lack of engaging battles and the multiple types of in-game currency make this app confusing and less fun than it could be. 

Rework trading, rework the stupid 5 battles in a row events and stop fleecing people. we will spend on the game, quit trying to for e us to spend on the game.","Thought i liked this game but trading is brokenThis game is easy to love at first but the lack of engaging battles and the multiple types of in-game currency make this app confusing and less fun than it could be. 

Rework trading, rework the stupid 5 battles in a row events and stop fleecing people. we will spend on the game, quit trying to for e us to spend on the game.",Negative
US,1,2025-02-05,1.1.0,Cards112,Trading,The trading is terrible and that’s one of the main aspects of Pokémon it’s a trading card game,TradingThe trading is terrible and that’s one of the main aspects of Pokémon it’s a trading card game,Negative
