Country,Rating,Date,Version,Username,Title,Content,Combined,Sentiment
US,1,2025-02-02,1.1.0,yoosiah,垃圾游戏,新卡抽不全，老卡赢不了，竞技体验和收集体验都没有，人才。,垃圾游戏新卡抽不全，老卡赢不了，竞技体验和收集体验都没有，人才。,Neutral
US,2,2025-02-02,1.1.0,johhnehd,The game is mechanics are contrived and not easy to use.,The trade mechanic makes this game hard to play or enjoy. Wish they would change it.,The game is mechanics are contrived and not easy to use.The trade mechanic makes this game hard to play or enjoy. Wish they would change it.,Negative
US,5,2025-02-02,1.1.0,Ellie.G.E,I love this game,This game is the most entertaining game I’ve ever played in my whole entire life,I love this gameThis game is the most entertaining game I’ve ever played in my whole entire life,Positive
US,2,2025-02-02,1.1.0,Calibrex,"Perfect Passive Play, but long to get what would you like","Takes a few minutes to log in, do a wonder pick, open 2 packs, and collect your daily. Thus allowing you to keep up. However, with the bad trading system and hard to come by pack points, you are held to the rng gods for what you can play.","Perfect Passive Play, but long to get what would you likeTakes a few minutes to log in, do a wonder pick, open 2 packs, and collect your daily. Thus allowing you to keep up. However, with the bad trading system and hard to come by pack points, you are held to the rng gods for what you can play.",Neutral
US,2,2025-02-02,1.1.0,ImMannyLou,"Gambling, Gacha, and User-Unfriendly","Understand that this game is entirely free to play, and you don’t have to spend any money. However, it’s crucial to recognize that the game’s primary objective is to generate revenue rather than providing an enjoyable gaming experience. This practice is quite prevalent in the current mobile gaming industry. They essentially target nostalgic players and those experiencing FOMO (Fear Of Missing Out) to entice them into spending money. Remember that the items in this game are entirely digital and have no monetary value. Simply invest your time, and if you genuinely want to spend money, it’s essentially a waste of it.","Gambling, Gacha, and User-UnfriendlyUnderstand that this game is entirely free to play, and you don’t have to spend any money. However, it’s crucial to recognize that the game’s primary objective is to generate revenue rather than providing an enjoyable gaming experience. This practice is quite prevalent in the current mobile gaming industry. They essentially target nostalgic players and those experiencing FOMO (Fear Of Missing Out) to entice them into spending money. Remember that the items in this game are entirely digital and have no monetary value. Simply invest your time, and if you genuinely want to spend money, it’s essentially a waste of it.",Neutral
US,1,2025-02-02,1.1.0,koadri,Greedy,This is the Pokémon TRADING card game and you’re going to make a trade system utterly broken and forces players into an insanely greedy gacha system to use,GreedyThis is the Pokémon TRADING card game and you’re going to make a trade system utterly broken and forces players into an insanely greedy gacha system to use,Negative
US,5,2025-02-02,1.1.0,KingK4234,This game is pretty good,"This game is actually amazing and I downloaded it because of my brother and dad, they downloaded this game when it came out and I never thought of playing it, until today and now I am addicted even at lvl 3!","This game is pretty goodThis game is actually amazing and I downloaded it because of my brother and dad, they downloaded this game when it came out and I never thought of playing it, until today and now I am addicted even at lvl 3!",Positive
US,5,2025-02-02,1.1.0,Lil tiger oh,OMG this game is amazing,This game is amazing and if your a Pokémon collector this is the game for you my whole family has got this game it is so addicting,OMG this game is amazingThis game is amazing and if your a Pokémon collector this is the game for you my whole family has got this game it is so addicting,Positive
US,1,2025-02-02,1.1.0,Charloooty,Trading mechanic is BAD - Premium no longer worth the $10,I have so much resentment against the dev team behind TCG pocket. What first was such a great lil’ game has now given me so much frustration. I’ve been playing since day one WITH the premium pass and I can’t even trade more than a couple of EX cards with my girlfriend. That’s scuffed. Moreover; the premium pass has no value beyond the free daily pack. The premium shop will get nab maybe 8 hourglasses if you’re lucky. And 200 trade tokens (you need 500 to trade and ex). Holy moly fix your game and fix your premium shop.,Trading mechanic is BAD - Premium no longer worth the $10I have so much resentment against the dev team behind TCG pocket. What first was such a great lil’ game has now given me so much frustration. I’ve been playing since day one WITH the premium pass and I can’t even trade more than a couple of EX cards with my girlfriend. That’s scuffed. Moreover; the premium pass has no value beyond the free daily pack. The premium shop will get nab maybe 8 hourglasses if you’re lucky. And 200 trade tokens (you need 500 to trade and ex). Holy moly fix your game and fix your premium shop.,Negative
US,3,2025-02-02,1.1.0,Thehdkgdjvx,"It’s fun, but also hard","Sometimes if you want to get cards, I was trying to get Charizard, but I did not get a Charizard for three days until my dad gave me to Charizard by trading well we have to wait for two days and also battles are hard like you don’t know what cards do they have but some of them have good cards like me I have nine EX cards","It’s fun, but also hardSometimes if you want to get cards, I was trying to get Charizard, but I did not get a Charizard for three days until my dad gave me to Charizard by trading well we have to wait for two days and also battles are hard like you don’t know what cards do they have but some of them have good cards like me I have nine EX cards",Neutral
US,5,2025-02-01,1.1.0,Tyler van68,Cool,Love you game,CoolLove you game,Positive
US,1,2025-02-01,1.1.0,Rhoa23,Not spending another dollar,A “trading card game” means we can trade cards… this trade policy is ridiculous and anti-trading. It’s very much “give me money to buy packs” I’m not going to spend any more money on cards I can’t freely trade with friends. I’ve spent over $500 on this already. It stops here if this trade policy isn’t reversed.,Not spending another dollarA “trading card game” means we can trade cards… this trade policy is ridiculous and anti-trading. It’s very much “give me money to buy packs” I’m not going to spend any more money on cards I can’t freely trade with friends. I’ve spent over $500 on this already. It stops here if this trade policy isn’t reversed.,Negative
US,5,2025-02-01,1.1.0,izzi94bands,Brings back memories,Brings back early 2000 vibes and makes me want to invest $$$ since I’m not willing to get out of my way to go to the estate and buy the physical cards,Brings back memoriesBrings back early 2000 vibes and makes me want to invest $$$ since I’m not willing to get out of my way to go to the estate and buy the physical cards,Neutral
US,5,2025-02-01,1.1.0,Nomache,Having fun,"Great game, always been a fan of pokemon. Easy to play for free and also not too expensive to get good. The card art is the best part of the game.","Having funGreat game, always been a fan of pokemon. Easy to play for free and also not too expensive to get good. The card art is the best part of the game.",Positive
US,5,2025-02-01,1.1.0,Fudge roo to bb am,Pokemon tgc pocket review,"I love this game, but I would definitely recommend having an option where you can purchase a specific card for poke Gold because I’ve spent a lot of money on this game to get no new cards and it felt like the biggest waste of money, or make it easier and faster to get hourglasses you cant play this game for more then like 30 minutes, its so hard to get hour glasses and pack points","Pokemon tgc pocket reviewI love this game, but I would definitely recommend having an option where you can purchase a specific card for poke Gold because I’ve spent a lot of money on this game to get no new cards and it felt like the biggest waste of money, or make it easier and faster to get hourglasses you cant play this game for more then like 30 minutes, its so hard to get hour glasses and pack points",Positive
US,1,2025-02-01,1.1.0,Flygon35,Trading is broken,"Never seen a game with trading in the title be so bad at trading. The battling is good, but having to burn 4 ex’s to get enough to trade and then having to trade 1 to get 1 makes no sense how is it fair to have to basically trade 5 ex’s to get 1 in return. On top of all that and you can’t even trade full art ex’s. Won’t be spending any more money or playing for that matter until something is fixed.","Trading is brokenNever seen a game with trading in the title be so bad at trading. The battling is good, but having to burn 4 ex’s to get enough to trade and then having to trade 1 to get 1 makes no sense how is it fair to have to basically trade 5 ex’s to get 1 in return. On top of all that and you can’t even trade full art ex’s. Won’t be spending any more money or playing for that matter until something is fixed.",Negative
US,1,2025-02-01,1.1.0,PjayPay,Mid,2 packs a day and u can j get doodoo for like 2 weeks in a row need to add more achievements more solo battles and challenges there’s just not enough to do,Mid2 packs a day and u can j get doodoo for like 2 weeks in a row need to add more achievements more solo battles and challenges there’s just not enough to do,Neutral
US,5,2025-02-01,1.1.0,Mr.b is the goat,About cards etc.,I like how the game is like Pokémon go it’s the same company but you can make a account and claim cards,About cards etc.I like how the game is like Pokémon go it’s the same company but you can make a account and claim cards,Positive
US,5,2025-02-01,1.1.0,Toxicpanda1123,10/10 but….,Great game have been playing it since it came out but i have yet to pull a big man blastoise,10/10 but….Great game have been playing it since it came out but i have yet to pull a big man blastoise,Positive
US,5,2025-02-01,1.1.0,p.aborrezco,This is great!!,Amazing!!,This is great!!Amazing!!,Positive
US,5,2025-02-01,1.1.0,Kashbros1,Gg,Game is so good I was waiting for trading rare cards to get game is challenging,GgGame is so good I was waiting for trading rare cards to get game is challenging,Positive
US,2,2025-02-01,1.1.0,TJ 4s,This is not a “Trading” Card Game,The trading system is predatory to the point where it consumes more cards than you receive through the trade. Maybe after a months worth of play you will have the resources to trade ONE card.,This is not a “Trading” Card GameThe trading system is predatory to the point where it consumes more cards than you receive through the trade. Maybe after a months worth of play you will have the resources to trade ONE card.,Negative
US,1,2025-02-01,1.1.0,pipluppicked,Trading is terrible.,How did they fumble trading so bad? It is upsetting that I have been waiting for a mechanic for months to be let down. Please let us trade more without tossing cards. It is not worth it.,Trading is terrible.How did they fumble trading so bad? It is upsetting that I have been waiting for a mechanic for months to be let down. Please let us trade more without tossing cards. It is not worth it.,Negative
US,1,2025-02-01,1.1.0,Pokester123,A lot of potential wasted,"Need to fix trading, it would make this game great if we had a complete free market to trade cards","A lot of potential wastedNeed to fix trading, it would make this game great if we had a complete free market to trade cards",Neutral
US,1,2025-02-01,1.1.0,yiirefuk,They took the T out of TCG,"This game has so much potential. But they implementation has completely ruined any chance this game had of being a long term, fun game to play. 

New players will never have enough cards to trade and catch up with their friends. 
Small spenders also won’t have enough cards to trade for what they want. 

Whales are the only people who could afford to use the trade feature, but because they don’t let 2* or above cards get traded, they have no reason to use trades. 

They implemented a system that works for NO ONE. 

I tried to do a trade with friends for a card today to see how it worked in practice. It was a nightmare. We couldn’t help each other at all and it ended with me not making the deck I wanted to. 

This game could be GREAT. The best digital card collecting game out there. But they’ve destroyed a main pillar of trading cards games. TRADING. Do not download until they’ve fixed this problem. You will be behind with no way to catch up.","They took the T out of TCGThis game has so much potential. But they implementation has completely ruined any chance this game had of being a long term, fun game to play. 

New players will never have enough cards to trade and catch up with their friends. 
Small spenders also won’t have enough cards to trade for what they want. 

Whales are the only people who could afford to use the trade feature, but because they don’t let 2* or above cards get traded, they have no reason to use trades. 

They implemented a system that works for NO ONE. 

I tried to do a trade with friends for a card today to see how it worked in practice. It was a nightmare. We couldn’t help each other at all and it ended with me not making the deck I wanted to. 

This game could be GREAT. The best digital card collecting game out there. But they’ve destroyed a main pillar of trading cards games. TRADING. Do not download until they’ve fixed this problem. You will be behind with no way to catch up.",Negative
US,4,2025-02-01,1.1.0,Turtl taco,Wish it wasn’t so pay to win,Hi so I’ve been playing this game for awhile now and haven&#39;t completed much of the Pokédex. Only two boosters a day is kinda rough. I wish for a little more game aspect in it and not so much waiting around for two packs a day. Good game though,Wish it wasn’t so pay to winHi so I’ve been playing this game for awhile now and haven&#39;t completed much of the Pokédex. Only two boosters a day is kinda rough. I wish for a little more game aspect in it and not so much waiting around for two packs a day. Good game though,Positive
US,4,2025-02-01,1.1.0,😡🤨😔🦧,Yrs,It’s good,YrsIt’s good,Positive
US,5,2025-02-01,1.1.0,Blunder Burb,Fix trading,Trading should cost the stardust stuff and have a wonder trade like board where people can list a card they have and a card they want and anyone can trade with them. Otherwise recommend,Fix tradingTrading should cost the stardust stuff and have a wonder trade like board where people can list a card they have and a card they want and anyone can trade with them. Otherwise recommend,Neutral
US,5,2025-02-01,1.1.0,LazySlowpoke1234,Yes.,I. Got. Mew EX.,Yes.I. Got. Mew EX.,Positive
US,1,2025-02-01,1.1.0,NashT24,Trading,The trading system is horrible why would you ever want to take the chance to trade when you have to give up like 5 cards just to do it and you dont even know what your getting in return. Was really excited about this update but this probably ruined the game,TradingThe trading system is horrible why would you ever want to take the chance to trade when you have to give up like 5 cards just to do it and you dont even know what your getting in return. Was really excited about this update but this probably ruined the game,Negative
US,1,2025-02-01,1.1.0,corruptbrokerage,Trading is not good,Make it more casual,Trading is not goodMake it more casual,Negative
US,1,2025-02-01,1.1.0,BH9988,"Quick rise, quick fall…","Downloaded the game the day it released. Opened some packs, had solid pulls. Game felt “fair” for what it was. So much better than other games of its type. So much better in fact that I actually subscribed to the monthly pay card since it felt worth it to support the direction it looked like they were going. 

Fast forward to the newest set that just released. Saved enough hourglasses to open 70 packs on release date. Out of those 70 packs, I pulled a single EX card. Just one.

Combine that with the trading system they just introduced that expects you to throw away STACKS of good cards to trade a single card with someone.

Game started out so great. Now I’ve cancelled my monthly card and will likely uninstall soon. Shame they got so greedy so quickly. Could have been a lot of fun otherwise.","Quick rise, quick fall…Downloaded the game the day it released. Opened some packs, had solid pulls. Game felt “fair” for what it was. So much better than other games of its type. So much better in fact that I actually subscribed to the monthly pay card since it felt worth it to support the direction it looked like they were going. 

Fast forward to the newest set that just released. Saved enough hourglasses to open 70 packs on release date. Out of those 70 packs, I pulled a single EX card. Just one.

Combine that with the trading system they just introduced that expects you to throw away STACKS of good cards to trade a single card with someone.

Game started out so great. Now I’ve cancelled my monthly card and will likely uninstall soon. Shame they got so greedy so quickly. Could have been a lot of fun otherwise.",Positive
US,1,2025-02-01,1.1.0,Chewookiee,Trading tanked this game,"This game was meant for nostalgia. It really did a great job of rallying the feelings of playing in the school yard as a kid. But the one thing I remember most is trading my cards. This game takes that feeling and absolutely drags it through the dirt. They teased the feature for months. When they released the feature, it requires you to actively destroy massive parts of your collection to trade a single card. It is restrictive to the level of predatory and pose forces the question of if false advertisement should be claimed due to the name of the game implying “trading”.","Trading tanked this gameThis game was meant for nostalgia. It really did a great job of rallying the feelings of playing in the school yard as a kid. But the one thing I remember most is trading my cards. This game takes that feeling and absolutely drags it through the dirt. They teased the feature for months. When they released the feature, it requires you to actively destroy massive parts of your collection to trade a single card. It is restrictive to the level of predatory and pose forces the question of if false advertisement should be claimed due to the name of the game implying “trading”.",Neutral
US,1,2025-02-01,1.1.0,xpheonix393x,Honest review,"The Art is amazing, but sadly everything else leaves something to be desired. Every interaction requires more interactions than you could shake a stick at. I would honestly love to spend more time on the game, but with needing 12 taps or interactions when you open a pack and draw a new card it feels like a needless time sink. However I will say that the art is 11/10 and I wish they were physical cards I could display.","Honest reviewThe Art is amazing, but sadly everything else leaves something to be desired. Every interaction requires more interactions than you could shake a stick at. I would honestly love to spend more time on the game, but with needing 12 taps or interactions when you open a pack and draw a new card it feels like a needless time sink. However I will say that the art is 11/10 and I wish they were physical cards I could display.",Neutral
US,5,2025-02-01,1.1.0,jjdjdieoe,Best game,Best Pokémon pack game I’ve ever played in my life and I’m 20,Best gameBest Pokémon pack game I’ve ever played in my life and I’m 20,Positive
US,3,2025-02-01,1.1.0,good_at_games,Neglect to trading on a “trading card game”,"Come on…..this is a new level of destructive greed. Who cares about some people who want to cheat, a real trading system could have made this a real memorable game. Would have actually been game breaking, so pathetic they thought the decision to neglect trading would make more money than just making a good game. It was already insanely profitable and yall just have to ruin. Yall could fix it before it’s too late but that timers almost out. ⏰","Neglect to trading on a “trading card game”Come on…..this is a new level of destructive greed. Who cares about some people who want to cheat, a real trading system could have made this a real memorable game. Would have actually been game breaking, so pathetic they thought the decision to neglect trading would make more money than just making a good game. It was already insanely profitable and yall just have to ruin. Yall could fix it before it’s too late but that timers almost out. ⏰",Negative
US,1,2025-02-01,1.1.0,AngryGamerGuy22,"Quit now, a game with so much wasted potential","I understand their idea to restrict some trading, to keep the game balanced. But it’s ridiculous and helps no one, not even players that pay.

Trading rarity for rarity should be allowed for all cards.

A lot of us have duplicates of rare cards, and should be allowed to have some sort of pittance afforded.

3 immersives of the same card? Please let me trade for the other. Maybe even restrict to just the same set for the higher rarity cards— still keeps the game balanced.

And please include promo cards to be traded too, new players don’t get a chance.","Quit now, a game with so much wasted potentialI understand their idea to restrict some trading, to keep the game balanced. But it’s ridiculous and helps no one, not even players that pay.

Trading rarity for rarity should be allowed for all cards.

A lot of us have duplicates of rare cards, and should be allowed to have some sort of pittance afforded.

3 immersives of the same card? Please let me trade for the other. Maybe even restrict to just the same set for the higher rarity cards— still keeps the game balanced.

And please include promo cards to be traded too, new players don’t get a chance.",Neutral
US,1,2025-02-01,1.1.0,Farmer idle,Trading,"It’s awful, there’s too many restrictions that it hurts!","TradingIt’s awful, there’s too many restrictions that it hurts!",Negative
US,5,2025-02-01,1.1.0,JAYCOOL1&$,Great game!,"I started collecting cards when I was 6 in 2018, and at that time I just knew everyone loved Pokémon and the cards could be expensive, this app showed me things about the game that I did not know because the cards didn’t come with a rule book, and this app is also cool because you can now have hundreds of cards all in your pocket in one small device. Definitely a 5 star game.","Great game!I started collecting cards when I was 6 in 2018, and at that time I just knew everyone loved Pokémon and the cards could be expensive, this app showed me things about the game that I did not know because the cards didn’t come with a rule book, and this app is also cool because you can now have hundreds of cards all in your pocket in one small device. Definitely a 5 star game.",Positive
US,1,2025-02-01,1.1.0,Bxhsjdkwjahsghshqisj,Predatory game.,"Not only did they make the trading system horrible, but also if you&#39;re free to play and don&#39;t want to spend money, don&#39;t even bother with this game. I saved 750 hourglasses(the pack currency) over 2 months for the new expansion, opened 70 packs, and got absolutely nothing good. This is probably around $100 worth of packs or maybe even more, so in conclusion this game is extremely greedy and predatory. Don&#39;t bother spending money or trying to save up after playing everyday, because you will get nothing in return. Great potential turned into garbage. This game will be forgotten soon.","Predatory game.Not only did they make the trading system horrible, but also if you&#39;re free to play and don&#39;t want to spend money, don&#39;t even bother with this game. I saved 750 hourglasses(the pack currency) over 2 months for the new expansion, opened 70 packs, and got absolutely nothing good. This is probably around $100 worth of packs or maybe even more, so in conclusion this game is extremely greedy and predatory. Don&#39;t bother spending money or trying to save up after playing everyday, because you will get nothing in return. Great potential turned into garbage. This game will be forgotten soon.",Negative
